{
  "schema_version": "1.0.0",
  "page_id": "OPTCON-RL_optimization_2026_09_14--6c1dba877ca1:p0046",
  "document_id": "OPTCON-RL_optimization_2026_09_14--6c1dba877ca1",
  "source": {
    "pdf_sha256": "6c1dba877ca102f055845618f73205b71450b819e0cc09e149e1150017e458ea",
    "page_index": 45,
    "physical_page_number": 46,
    "pdf_label_raw": "<FEFF00340032>",
    "pdf_label": "42",
    "geometry": {
      "width_pt": 453.5429992675781,
      "height_pt": 255.1179962158203,
      "rotation": 0,
      "cropbox": [
        0.0,
        0.0,
        453.5429992675781,
        255.1179962158203
      ],
      "mediabox": [
        0.0,
        0.0,
        453.5429992675781,
        255.1179962158203
      ]
    }
  },
  "identity": {
    "title": "Example: Gradient Method applied to Quadratic Programs",
    "title_method": "top_lines_font_geometry",
    "title_confidence": 0.8,
    "title_bbox": [
      10.35200023651123,
      6.720991134643555,
      355.16290283203125,
      21.06719207763672
    ],
    "printed_number_candidates": [
      {
        "number": 42,
        "total": 73,
        "raw": "42 |73",
        "bbox": [
          150.68800354003906,
          247.92860412597656,
          447.8712158203125,
          258.29376220703125
        ]
      }
    ],
    "extraction_warnings": []
  },
  "artifacts": {
    "text": {
      "path": "documents/OPTCON-RL_optimization_2026_09_14--6c1dba877ca1/pages/0046/text.txt",
      "sha256": "d492c0232835d392e733a4a393309001d74f49e161f745ba268b61e7560dac33"
    },
    "reading_order_text": {
      "path": "documents/OPTCON-RL_optimization_2026_09_14--6c1dba877ca1/pages/0046/text.reading-order.txt",
      "sha256": "014d6c91a397391bd9c7d775e8e63c9deed6a5131aaf30a17b63d55bb6303bde"
    },
    "layout": {
      "path": "documents/OPTCON-RL_optimization_2026_09_14--6c1dba877ca1/pages/0046/layout.json",
      "sha256": "b22987baef5a2e37f6fc6de91fda23f4867dad6cc814dcb48a74cde07cbafcee"
    },
    "render": {
      "path": "documents/OPTCON-RL_optimization_2026_09_14--6c1dba877ca1/pages/0046/render.png",
      "sha256": "a64bfa108daa146f1fc737dd9ad0b7fdbfa08c4b9206bf972557ed9516973f9e",
      "width_px": 908,
      "height_px": 511,
      "dpi": 144,
      "renderer": "PyMuPDF 1.28.2",
      "pixel_sha256": "f4052e74a120dc0dd4f667091928e9ac3dd6f2cea8829c82d8d7bdbac0d99b93"
    }
  },
  "context": {
    "previous_page_id": "OPTCON-RL_optimization_2026_09_14--6c1dba877ca1:p0045",
    "next_page_id": "OPTCON-RL_optimization_2026_09_14--6c1dba877ca1:p0047"
  },
  "relations": [],
  "companion_mapping": {
    "default_count": 1,
    "decision": "pending_analysis",
    "subpages": [],
    "split_rationale": null
  },
  "analysis": {
    "status": "pending",
    "result": null
  }
}
