{
  "schema_version": "1.0.0",
  "page_id": "OPTCON-RL_optimization_2026_09_14--6c1dba877ca1:p0029",
  "document_id": "OPTCON-RL_optimization_2026_09_14--6c1dba877ca1",
  "source": {
    "pdf_sha256": "6c1dba877ca102f055845618f73205b71450b819e0cc09e149e1150017e458ea",
    "page_index": 28,
    "physical_page_number": 29,
    "pdf_label_raw": "<FEFF00320038>",
    "pdf_label": "28",
    "geometry": {
      "width_pt": 453.5429992675781,
      "height_pt": 255.1179962158203,
      "rotation": 0,
      "cropbox": [
        0.0,
        0.0,
        453.5429992675781,
        255.1179962158203
      ],
      "mediabox": [
        0.0,
        0.0,
        453.5429992675781,
        255.1179962158203
      ]
    }
  },
  "identity": {
    "title": "Gradient methods: introduction",
    "title_method": "top_lines_font_geometry",
    "title_confidence": 0.8,
    "title_bbox": [
      10.35200023651123,
      6.720991134643555,
      195.7335968017578,
      21.06719207763672
    ],
    "printed_number_candidates": [
      {
        "number": 28,
        "total": 73,
        "raw": "28 |73",
        "bbox": [
          150.68800354003906,
          247.92860412597656,
          447.8712158203125,
          258.29376220703125
        ]
      }
    ],
    "extraction_warnings": []
  },
  "artifacts": {
    "text": {
      "path": "documents/OPTCON-RL_optimization_2026_09_14--6c1dba877ca1/pages/0029/text.txt",
      "sha256": "8d0d5d20e8ce0947c202b6429dfba8208b9d1d4f36fad80138a9b837cce615d9"
    },
    "reading_order_text": {
      "path": "documents/OPTCON-RL_optimization_2026_09_14--6c1dba877ca1/pages/0029/text.reading-order.txt",
      "sha256": "21757da4a1944a79638d2d6d44406740f544e093730995d8dad99d350ea70682"
    },
    "layout": {
      "path": "documents/OPTCON-RL_optimization_2026_09_14--6c1dba877ca1/pages/0029/layout.json",
      "sha256": "816719239094c5ef39b4ae5c12234a42962c6d8cb92fa8644ed523143d886cb4"
    },
    "render": {
      "path": "documents/OPTCON-RL_optimization_2026_09_14--6c1dba877ca1/pages/0029/render.png",
      "sha256": "d48ceda5ef68161cebe70ce9d256c2f0ee899b7415d6d492e6b23dd93e4175e5",
      "width_px": 908,
      "height_px": 511,
      "dpi": 144,
      "renderer": "PyMuPDF 1.28.2",
      "pixel_sha256": "c0c986f1d7f0167c82aa48203584bbd841a095d4d018ed62b9e1dd2efe03c3ec"
    }
  },
  "context": {
    "previous_page_id": "OPTCON-RL_optimization_2026_09_14--6c1dba877ca1:p0028",
    "next_page_id": "OPTCON-RL_optimization_2026_09_14--6c1dba877ca1:p0030"
  },
  "relations": [],
  "companion_mapping": {
    "default_count": 1,
    "decision": "pending_analysis",
    "subpages": [],
    "split_rationale": null
  },
  "analysis": {
    "status": "pending",
    "result": null
  }
}
