{
  "schema_version": "1.0.0",
  "page_id": "OPTCON-RL_optimality_conditions_KKT_2026_10_08--937db0d7a574:p0002",
  "document_id": "OPTCON-RL_optimality_conditions_KKT_2026_10_08--937db0d7a574",
  "source": {
    "pdf_sha256": "937db0d7a574f549eb1181f22207ccfa886ae6d79206720718692bfd6015bd97",
    "page_index": 1,
    "physical_page_number": 2,
    "pdf_label_raw": "<FEFF0031>",
    "pdf_label": "1",
    "geometry": {
      "width_pt": 453.5429992675781,
      "height_pt": 255.1179962158203,
      "rotation": 0,
      "cropbox": [
        0.0,
        0.0,
        453.5429992675781,
        255.1179962158203
      ],
      "mediabox": [
        0.0,
        0.0,
        453.5429992675781,
        255.1179962158203
      ]
    }
  },
  "identity": {
    "title": "Discrete-time control system and notation (Refresh)",
    "title_method": "top_lines_font_geometry",
    "title_confidence": 0.8,
    "title_bbox": [
      10.35200023651123,
      6.720991134643555,
      315.6678466796875,
      21.06719207763672
    ],
    "printed_number_candidates": [
      {
        "number": 1,
        "total": 18,
        "raw": "1 |18",
        "bbox": [
          102.9229965209961,
          247.8778533935547,
          447.8712158203125,
          253.93292236328125
        ]
      }
    ],
    "extraction_warnings": []
  },
  "artifacts": {
    "text": {
      "path": "documents/OPTCON-RL_optimality_conditions_KKT_2026_10_08--937db0d7a574/pages/0002/text.txt",
      "sha256": "26643e72d3d726db1b9d47a463951aadbb773c08d1cd8a682a3e84ee8ad2f211"
    },
    "reading_order_text": {
      "path": "documents/OPTCON-RL_optimality_conditions_KKT_2026_10_08--937db0d7a574/pages/0002/text.reading-order.txt",
      "sha256": "473c51c6c7b94969cf218f37b1518b9fd7465fd03045f225d491057c26db8777"
    },
    "layout": {
      "path": "documents/OPTCON-RL_optimality_conditions_KKT_2026_10_08--937db0d7a574/pages/0002/layout.json",
      "sha256": "f775169eb94a0395580cd4ada98249f03997fdd549c1e67c7268c716b462e12c"
    },
    "render": {
      "path": "documents/OPTCON-RL_optimality_conditions_KKT_2026_10_08--937db0d7a574/pages/0002/render.png",
      "sha256": "98f1d6913e117e92900825d0e48dfb3c5e8eacfa95de721dc9e40353e4edfa8a",
      "width_px": 908,
      "height_px": 511,
      "dpi": 144,
      "renderer": "PyMuPDF 1.28.2",
      "pixel_sha256": "1aa1771425a89284f9eac6b95a6ef80aaf093bbcde65e8c0f0f982193a399aeb"
    }
  },
  "context": {
    "previous_page_id": "OPTCON-RL_optimality_conditions_KKT_2026_10_08--937db0d7a574:p0001",
    "next_page_id": "OPTCON-RL_optimality_conditions_KKT_2026_10_08--937db0d7a574:p0003"
  },
  "relations": [],
  "companion_mapping": {
    "default_count": 1,
    "decision": "pending_analysis",
    "subpages": [],
    "split_rationale": null
  },
  "analysis": {
    "status": "pending",
    "result": null
  }
}
