{
  "schema_version": "1.0.0",
  "page_id": "OPTCON-RL_optimality_conditions_KKT_2026_10_08--937db0d7a574:p0012",
  "document_id": "OPTCON-RL_optimality_conditions_KKT_2026_10_08--937db0d7a574",
  "source": {
    "pdf_sha256": "937db0d7a574f549eb1181f22207ccfa886ae6d79206720718692bfd6015bd97",
    "page_index": 11,
    "physical_page_number": 12,
    "pdf_label_raw": "<FEFF00310030>",
    "pdf_label": "10",
    "geometry": {
      "width_pt": 453.5429992675781,
      "height_pt": 255.1179962158203,
      "rotation": 0,
      "cropbox": [
        0.0,
        0.0,
        453.5429992675781,
        255.1179962158203
      ],
      "mediabox": [
        0.0,
        0.0,
        453.5429992675781,
        255.1179962158203
      ]
    }
  },
  "identity": {
    "title": "Optimality conditions (Refresh from “Optimization” part)",
    "title_method": "top_lines_font_geometry",
    "title_confidence": 0.8,
    "title_bbox": [
      10.35200023651123,
      6.720991134643555,
      348.7358093261719,
      21.06719207763672
    ],
    "printed_number_candidates": [
      {
        "number": 10,
        "total": 18,
        "raw": "10 |18",
        "bbox": [
          99.74800109863281,
          247.8778533935547,
          447.8712158203125,
          253.93292236328125
        ]
      }
    ],
    "extraction_warnings": []
  },
  "artifacts": {
    "text": {
      "path": "documents/OPTCON-RL_optimality_conditions_KKT_2026_10_08--937db0d7a574/pages/0012/text.txt",
      "sha256": "13d2fd08df10d0d25e1115083d238c9393909419aa376a618563fbcfe4b9f8b7"
    },
    "reading_order_text": {
      "path": "documents/OPTCON-RL_optimality_conditions_KKT_2026_10_08--937db0d7a574/pages/0012/text.reading-order.txt",
      "sha256": "0900065d0035b0c2f51d4fc2953100e46f24889c5458463e5465329dbb44d537"
    },
    "layout": {
      "path": "documents/OPTCON-RL_optimality_conditions_KKT_2026_10_08--937db0d7a574/pages/0012/layout.json",
      "sha256": "0acc8ee88a0090012c0feab90c2480d8839488518cf55d98a90254d184a9eebb"
    },
    "render": {
      "path": "documents/OPTCON-RL_optimality_conditions_KKT_2026_10_08--937db0d7a574/pages/0012/render.png",
      "sha256": "8dea9375eab26b78cf942c188a4ac815098a60c2745a1ef87e9eeed8e42ceb12",
      "width_px": 908,
      "height_px": 511,
      "dpi": 144,
      "renderer": "PyMuPDF 1.28.2",
      "pixel_sha256": "0b433c3810378c81beec9cd6644f526394f2f04b9e15f52bda99ce1b120c460c"
    }
  },
  "context": {
    "previous_page_id": "OPTCON-RL_optimality_conditions_KKT_2026_10_08--937db0d7a574:p0011",
    "next_page_id": "OPTCON-RL_optimality_conditions_KKT_2026_10_08--937db0d7a574:p0013"
  },
  "relations": [],
  "companion_mapping": {
    "default_count": 1,
    "decision": "pending_analysis",
    "subpages": [],
    "split_rationale": null
  },
  "analysis": {
    "status": "pending",
    "result": null
  }
}
