{
  "schema_version": "1.0.0",
  "page_id": "OPTCON-RL_optimality_conditions_KKT_2026_10_08--937db0d7a574:p0016",
  "document_id": "OPTCON-RL_optimality_conditions_KKT_2026_10_08--937db0d7a574",
  "source": {
    "pdf_sha256": "937db0d7a574f549eb1181f22207ccfa886ae6d79206720718692bfd6015bd97",
    "page_index": 15,
    "physical_page_number": 16,
    "pdf_label_raw": "<FEFF00310034>",
    "pdf_label": "14",
    "geometry": {
      "width_pt": 453.5429992675781,
      "height_pt": 255.1179962158203,
      "rotation": 0,
      "cropbox": [
        0.0,
        0.0,
        453.5429992675781,
        255.1179962158203
      ],
      "mediabox": [
        0.0,
        0.0,
        453.5429992675781,
        255.1179962158203
      ]
    }
  },
  "identity": {
    "title": "KKT conditions for constrained optimal control",
    "title_method": "top_lines_font_geometry",
    "title_confidence": 0.8,
    "title_bbox": [
      87.87699890136719,
      97.489990234375,
      365.66241455078125,
      111.83618927001953
    ],
    "printed_number_candidates": [],
    "extraction_warnings": []
  },
  "artifacts": {
    "text": {
      "path": "documents/OPTCON-RL_optimality_conditions_KKT_2026_10_08--937db0d7a574/pages/0016/text.txt",
      "sha256": "5abb570a21db741dd6bafadadbfba155d54a9419a8b1e13b6f37af2922cafce8"
    },
    "reading_order_text": {
      "path": "documents/OPTCON-RL_optimality_conditions_KKT_2026_10_08--937db0d7a574/pages/0016/text.reading-order.txt",
      "sha256": "f7682afa3b9be3d4e000effda24f450bcefe09babff1f5a13dfc70afbc9f13fb"
    },
    "layout": {
      "path": "documents/OPTCON-RL_optimality_conditions_KKT_2026_10_08--937db0d7a574/pages/0016/layout.json",
      "sha256": "8f2c73a3d645320f06316378f01badd56b8f73dc292df385981a143ac348509d"
    },
    "render": {
      "path": "documents/OPTCON-RL_optimality_conditions_KKT_2026_10_08--937db0d7a574/pages/0016/render.png",
      "sha256": "b06347a8ff80031e20dbcdf7d0574a9aacd18409836557ba604571cea5d747f5",
      "width_px": 908,
      "height_px": 511,
      "dpi": 144,
      "renderer": "PyMuPDF 1.28.2",
      "pixel_sha256": "59c8e21e273aa6b4f507637b00da37956189c111e04412e408579398d79922e5"
    }
  },
  "context": {
    "previous_page_id": "OPTCON-RL_optimality_conditions_KKT_2026_10_08--937db0d7a574:p0015",
    "next_page_id": "OPTCON-RL_optimality_conditions_KKT_2026_10_08--937db0d7a574:p0017"
  },
  "relations": [],
  "companion_mapping": {
    "default_count": 1,
    "decision": "pending_analysis",
    "subpages": [],
    "split_rationale": null
  },
  "analysis": {
    "status": "pending",
    "result": null
  }
}
